{
  "schema_version": 1,
  "release_id": "example-release",
  "repository": "phuongphh/FinanceAssistant",
  "environment": "production-vps",
  "source_sha": "bbbbbbbbbbbbbbbbbbbbbbbbbbbbbbbbbbbbbbbb",
  "dev_verified_sha": "bbbbbbbbbbbbbbbbbbbbbbbbbbbbbbbbbbbbbbbb",
  "release_pr": "https://github.com/example/product/pull/2",
  "artifact": {
    "digest": "sha256:cccccccccccccccccccccccccccccccccccccccccccccccccccccccccccccccc",
    "platform": "linux/amd64"
  },
  "approval": {
    "reference": "https://github.com/example/product/issues/1",
    "scope_id": "approved-batch-example",
    "actor": "example-owner",
    "approved_at": "2026-10-25T00:00:00Z"
  },
  "acceptance_evidence": [
    {
      "url": "https://github.com/example/product/actions/runs/1",
      "description": "Example only; not actual evidence"
    }
  ],
  "migration_plan": "Example: none",
  "config_references": [],
  "backup_evidence": [
    {
      "url": "https://github.com/example/product/actions/runs/1",
      "description": "Example only; not actual evidence"
    }
  ],
  "rollback_limits": "Example only; verify data compatibility"
}
